summary,actions,datatypes
"The mobile app offers a simple and minimal interface to help create professional-looking intro videos with customizable templates, text captions, and music, enhancing your videos with a professional touch.",The user selects or takes a new photo to include in the video.,"['photos', 'location data', 'camera settings']"
"The mobile app helps users plan and navigate their journeys with multiple modes of transport, purchase tickets conveniently, keep all tickets in one place, compare route options, and easily manage ticket information and payments.","The user chooses the schedule, means of transport, and routes for their journey.","['travel schedule', 'means of transport', 'routes']"
"The mobile app makes it easy to manage MEO services, offering tailored deals, enhancing MEO experience, managing family services, viewing and paying bills, tracking usage, utilizing a digital assistant, accessing contract information, obtaining PIN and PUK for mobiles, and accessing customer support channels.","The user can easily access all support channels available, including FAQs, user community, store locations, and support hotlines.","['location', 'user preferences', 'contact information', 'device information']"
"The mobile app helps users plan and navigate their journeys with multiple modes of transport, purchase tickets conveniently, keep all tickets in one place, compare route options, and easily manage ticket information and payments.","The user checks their ticket information, validity periods, and remaining trips through the app.","['ticket information', 'validity periods', 'remaining trips']"
"The mobile app offers fun and effective language learning in over 40 languages through gamified lessons, developed by experts to improve speaking, reading, listening, and writing skills, with progress tracking and a global community of over 500 million learners.",The user tracks their progress and works towards language learning goals.,"['language learning progress', 'goals', 'preferred study methods']"
"The mobile app offers fast, smart, and anonymous browsing with a redesigned interface, enhanced anonymity features, private browsing mode, and intuitive design, utilizing the Tor anonymization network to prioritize user anonymity and privacy.",The app provides a Private Browsing mode that auto clears browsing history and cookies.,"['browsing history', 'cookies']"
"The mobile app helps users find job opportunities, stay informed with industry news, expand their professional network, and access tools for career development, including job notifications and interview tips, all while showcasing their experience, skills, and connections on their LinkedIn profiles.",The user finds job offers and stays informed with current industry news on LinkedIn.,"['job preferences', 'industry news preferences']"
"The mobile app tracks Heart Rate Variability measurements from your Apple Watch to provide insight on your body's stress levels, readiness, recovery, and overall health, with features like notifications, daily tracking, comparison with key metrics, long-term trend analysis, and widgets for easy monitoring.",The user tracks short-term HRV measurements and long-term trends using HRV Tracker.,"{'Personal data': ['heart rate variability (HRV) measurements', 'HRV trends']}"
"The mobile app features a variety of functions including waking up and going to sleep to music, exclusive designer clocks, weather updates, countdown to events, a multifunctional timer, and a built-in flashlight.",The user goes to sleep to their favorite songs or white noise.,"{'Personal data': ['favorite songs', 'white noise preferences']}"
"The mobile app allows users to plan routes along official hiking trails in Poland, record tracks, view points of interest, and access detailed touristic maps for various regions, with offline map downloads available.",The app provides information about points of interest along the routes.,"['location data', 'travel preferences', 'historical interests']"
"The mobile app allows users to manage their electricity and gas-related matters, such as submitting meter readings, paying bills, viewing multiple account statements, and setting up notifications for bill arrivals and meter reading periods.",The user can make payments for their bills instantly using a bank card.,"['payment information', 'bank card details', 'billing information']"
"The mobile app, developed by educators, is a Swedish reading and writing app designed to encourage children to practice phonics, spelling, and reading through engaging games at various levels, featuring a rewarding system and characters in a fantasy world.",Children train to crack the reading code through listening and learning letter sounds.,"['reading skills', 'listening skills', 'letter sounds', 'age group']"
"The mobile app is designed to make everyday banking easy and convenient for both private and business customers, offering features such as account balance checking, card management, payment options including Apple Pay, and tools for tracking expenses and savings, along with a strong emphasis on security and feedback.",Private customers can start saving with the 'Easy Saver' feature.,"['savings goals', 'financial information', 'personal preferences']"
"The mobile app offers a wide range of beauty products from popular and new brands, making it convenient to shop for perfumes, makeup, skincare, and body care items with the assistance of knowledgeable staff either online or in-store.",The user explores thousands of products and navigates through clear categories for a quick and simple shopping experience.,"{'Personal data': ['product preferences', 'browsing history', 'shopping habits', 'location']}"
"The mobile app allows users to conveniently view and browse Instagram stories anonymously, without requiring a username or password, and offers various features such as dark and white mode, no in-app purchases, and sharing full-size avatars.",The user can view and share full-size avatars.,['avatars']
"The mobile app provides easy and convenient access to selected ABUS products through a user-friendly interface, allowing for setup of cameras and recorders via QR code or IP address input, simultaneous viewing of recordings and live images from up to 16 cameras, remote access to live images and recordings, push notifications for events like doorbells, direct saving of images/clips, pinch-to-zoom function, control of PTZ cameras, and operation of switches or relays for functions like opening doors or activating light switches.",The app provides remote access to ABUS products via WLAN and mobile internet.,"['location data', 'device information', 'user credentials']"
"The mobile app transforms your photos into luminous watercolors, allowing you to create beautiful art for your home and share on social media, with customizable styles and high-resolution export options, supported on iOS devices.",The user creates an artist's journal or notebook using their watercolors.,"['artistic creations', 'medium preference', 'artistic interests']"
"The mobile app allows users to plan routes along official hiking trails in Poland, record tracks, view points of interest, and access detailed touristic maps for various regions, with offline map downloads available.","The app displays the planned route on a map with length, estimated time, and elevation profile.","['location data', 'route details', 'travel preferences']"
"The mobile app offers a wide range of beauty products from popular and new brands, making it convenient to shop for perfumes, makeup, skincare, and body care items with the assistance of knowledgeable staff either online or in-store.",The user renews their cosmetic bag with favorite classics and wants new trendy makeup.,"['cosmetic preferences', 'makeup interests', 'favorite products', 'trendy makeup']"
"The mobile app allows you to securely store and access files from any device, share files and folders easily, search for files by name and content, set permissions for sharing, access content offline, and receive notifications for important file activities, with options to purchase additional storage if needed.",The user can search for files by name and content.,"['search queries', 'file names', 'file content']"
"The mobile app shows parking spaces for people with disabilities on a map, covering 90% of Sweden's 290 municipalities, allowing users to easily locate nearby spots and receive directions to their chosen parking space.","If data is missing for a user's municipality, they can contact the app developer for assistance.",['municipality']
"The mobile app provides real-time information on speed cameras and traffic conditions in over 140 different regions, featuring a map with 38,000 fixed cameras across Europe, offline database, voting system, push notifications, and the ability to report and comment on speed cameras.",The user engages with the beta Auto-Pilot feature for warnings about Blitzers during longer trips outside the Landkreis.,"['location data', 'trip duration', 'Blitzers locations', 'beta Auto-Pilot feature usage']"
"The mobile app offers personal advice, market navigation, inspiration, care calendar, exclusive discounts, and more for DIY projects related to home and garden, providing expert tips, step-by-step guides, and shopping assistance with the ability to receive support via chat or video, and access to exclusive deals and product information directly on your smartphone, making it a convenient tool for all your DIY needs.",The user explores creative DIY projects from CREATE! by OBI.,"['DIY projects', 'creative interests', 'home improvement preferences']"
"The mobile app is a GPS camera used for fieldwork, allowing users to overlay and stamp photos with location, direction, altitude, date, and time taken, with additional features available for purchase such as editable notes overlay, custom export filename, batch edit notes overlay fields, and more.","The user can email or export photo data and notes in KML, KMZ, or CSV formats.","['photos', 'notes']"
"The mobile app is an interactive tool for learning and practicing Estonian verbs with activities such as quizzes and drills to help improve grammar and expand vocabulary, suitable for beginners and intermediate learners alike.",The app offers a way to increase and practice core Estonian vocabulary.,"['language learning preferences', 'vocabulary level', 'learning progress']"
"The mobile app offers access to 55,000 beauty products, exclusive member benefits, social sharing, beauty trends, tutorials, reviews, product ratings, favorites saving, customer service chat, giveaways, and a variety of beauty inspirations and hacks in a judgment-free environment.",The user finds their own unique style with the app.,"['clothing preferences', 'fashion interests', 'color preferences', 'body type']"
"The mobile app provides a convenient and simple experience for purchasing a wide range of products for home improvement, decoration, and gardening from Leroy Merlin, allowing for quick in-store pickups or home deliveries, order tracking, store information, and loyalty rewards.","The user scans products using the provided barcode to access information, customer reviews, and store stock availability.","['product information', 'customer reviews', 'store stock availability']"
"The mobile app offers engaging quiz-based games (kahoots) for students, teachers, company employees, trivia fans, and lifelong learners to increase engagement and learning, with features including creating and hosting quizzes, access to millions of learning games, and various study modes across different platforms.",Users play and engage with an audience ranging from 2 to 2000 people.,"{'personal_data': ['audience size', 'engagement level']}"
"The mobile app offers access to 55,000 beauty products, exclusive member benefits, social sharing, beauty trends, tutorials, reviews, product ratings, favorites saving, customer service chat, giveaways, and a variety of beauty inspirations and hacks in a judgment-free environment.",The user follows inspiring accounts.,"['user accounts', 'interests', 'preferred topics']"
"The mobile app provides a platform for users to create valuable relationships, find friends, and make empowered connections through its unique approach of allowing women to make the first move in dating, networking, and friend-finding modes.","At Bumble, women make the first move in heterosexual matches, with specific time limits to respond.","['gender', 'sexual orientation']"
"The mobile app offers a VPN proxy service for iPhone and iPad users with 11 protocols to choose from, support for up to 5 devices, 8000+ servers worldwide, fast connections, strict privacy policy, and security tools like Kill Switch for premium users.",The user may cancel their subscription at any time through their Apple ID Settings.,"['subscription details', 'Apple ID information']"
"The mobile app guides users through the process of choosing and interpreting statistical tests based on the type and relationship of variables selected, offering parametric tests for normally distributed metric variables and non-parametric tests for non-normally distributed ones, along with brief explanatory videos.",The user can watch short videos explaining how to perform and interpret the statistical procedures.,"['videos', 'statistical procedures', 'learning preferences']"
"The mobile app allows you to securely store and access files from any device, share files and folders easily, search for files by name and content, set permissions for sharing, access content offline, and receive notifications for important file activities, with options to purchase additional storage if needed.","The user can easily share files and folders with others for viewing, commenting, or editing.","['files', 'folders', 'shared users', 'comments', 'edits']"
"The mobile app allows users to shop, earn rewards points, access coupons and deals from partners like REWE, Amazon, and Burger King, pay securely with the app, redeem points for rewards, and benefit from personalized offers while supporting climate protection initiatives.","The user can shop, earn points, and redeem coupons at a wide range of partners using the PAYBACK App.","['purchase history', 'points balance', 'coupon preferences', 'partner transactions']"
"The mobile app provides convenient access to a wide selection of films and series, including premium content with over 12,000 titles from official distributors, offering the option to stream directly to a TV screen via Chromecast, support for offline viewing, and the ability to choose from Polish dubbing or subtitles.",The user watches legally and in the best quality directly from their smartphone with Polish voice-over or subtitles for movies and dubbing for cartoons.,"['location', 'language preferences', 'device type']"
"The mobile app offers a convenient and enjoyable shopping experience for shoes, handbags, clothing, and accessories from various top brands, along with features like membership benefits, product availability checking, image search, barcode scanner, and payment options, while also providing fashion inspiration and customer support.",The user makes safe purchases using various payment options provided by the app.,"['payment information', 'billing address', 'shipping address']"
"The mobile app provides users with a comprehensive overview of their pension scheme, including savings, returns, insurance policies, contributions, costs, and the option to book consultations and meetings with advisors, accessible in both Danish and English.",The user logs in using their MitID and selects a 4-digit pin code.,"['MitID', '4-digit pin code']"
"The mobile app is Denmark's new platform for digital mail, allowing users to easily receive, read, and respond to important messages from public authorities and private companies, with user-friendly design, push notifications, and upcoming features for signing documents and paying bills directly within the app, accessible for users over 15 years old with a MitID/NemID.",The user can choose to receive push notifications for new digital mails.,"['email address', 'notification preferences']"
"The mobile app offers a personalized music streaming experience with a vast music catalog, personalized playlists, offline listening, and various features like music identification, customized recommendations, and different subscription options for ad-free, high-quality music streaming.",The user explores music with lyrics and translations.,"['music preferences', 'lyrics', 'translation language preferences']"
"The mobile app allows users to stay connected with unlimited SMS and voice messages, video calls, group video chats, personalized reactions, chat designs, watching videos together, unlimited free video calls, sending files, making plans, sending and requesting payments, chatting with businesses, and cross-platform compatibility.",Users can record and send voice and video messages.,"['voice messages', 'video messages']"
"The mobile app allows users to plan routes along official hiking trails in Poland, record tracks, view points of interest, and access detailed touristic maps for various regions, with offline map downloads available.",The app provides navigation guidance on the planned route.,"['current location', 'destination', 'route preferences', 'mode of transportation']"
"The mobile app is an intuitive and powerful function generator that allows users to play various test tones, frequency sweeps, volume sweeps, music tones, and noise types, with advanced settings for customization and configuration flexibility.",The user changes the min/max slider frequency ranges.,['frequency ranges']
"The mobile app offers a fun and interactive hair salon experience with realistic hair styling, a variety of tools, braiding options, beard grooming, advanced hair color tools, clothing changes, accessories, photo booth features, and a gender-neutral aesthetic for kids to enjoy without time limits or third-party advertising.",The user uses the braiding tools for creating different types of braids on the character's hair.,"['hairstyle preferences', 'character customization preferences']"
"The mobile app offers engaging quiz-based games (kahoots) for students, teachers, company employees, trivia fans, and lifelong learners to increase engagement and learning, with features including creating and hosting quizzes, access to millions of learning games, and various study modes across different platforms.","Users get access to in-app-only study modes such as flashcards, repeat difficult questions, single-player, study groups, and read-aloud technology (Students only).","{'Personal data': ['study preferences', 'performance data', 'study group participation', 'student status']}"
"The mobile app offers a convenient shopping experience with features like browsing recipes, creating and sharing shopping lists, checking personal offers and coupons, and scanning a QR code instead of using a loyalty card at checkout.",The user browses tasty recipes on the app.,"['food preferences', 'cooking skills', 'dietary restrictions']"
"The mobile app is a GPS camera used for fieldwork, allowing users to overlay and stamp photos with location, direction, altitude, date, and time taken, with additional features available for purchase such as editable notes overlay, custom export filename, batch edit notes overlay fields, and more.","The user searches for photos by date, date range, or text used in notes and address.","['photos', 'dates', 'text in notes', 'addresses']"
"The mobile app allows Bank of Valletta customers to securely authenticate online purchases using their debit or credit card through a one-time enrollment process and either a passcode or biometric authentication, ensuring safe transactions even in areas with no internet connectivity.",The user reports suspicious communications or transactions to Bank of Valletta immediately if needed.,"['suspicious communications', 'transactions']"
"The mobile app allows you to manage your FBTO health insurance, including submitting health invoices, viewing your insurance details, and monitoring your healthcare expenses and payments conveniently.",The user can upload their healthcare bills.,"['healthcare bills', 'medical conditions', 'treatment received', 'insurance information']"
"The mobile app offers a variety of benefits and features for shopping, including the ability to purchase favorite products, access to services such as gl端ckskind and PAYBACK, and a unified view of all coupons, with the option to customize the app based on personal preferences and easily redeem coupons both in-store and online.","The user accesses and manages their coupons from dm, gl端ckskind, and PAYBACK in the 'Coupons' section.","['coupons', 'shopping preferences', 'loyalty program memberships']"
"The mobile app offers a personalized music streaming experience with a vast music catalog, personalized playlists, offline listening, and various features like music identification, customized recommendations, and different subscription options for ad-free, high-quality music streaming.",The user shares their love for music on social networks using the 'share' function.,"['music preferences', 'social network accounts']"
"The mobile app provides a platform for users to create valuable relationships, find friends, and make empowered connections through its unique approach of allowing women to make the first move in dating, networking, and friend-finding modes.","The app provides a platform for users to create new connections through different modes like Bumble Date, Bumble BFF, and Bumble Bizz.","['profile information', 'photos', 'location data', 'interests', 'profession', 'gender', 'sexual orientation']"
"The mobile app allows you to manage your everyday banking needs conveniently on your phone, including opening accounts, applying for loans, making payments, enhancing security features, and accessing various banking services.",The user applies for a credit card in their app in minutes.,"['personal identification information', 'financial information', 'employment status', 'credit score']"
"The mobile app offers a variety of benefits and features for shopping, including the ability to purchase favorite products, access to services such as gl端ckskind and PAYBACK, and a unified view of all coupons, with the option to customize the app based on personal preferences and easily redeem coupons both in-store and online.",The user views various highlights and recommendations on their personalized homepage upon opening the app.,"['user preferences', 'viewing history', 'location data', 'interests']"
"The mobile app allows you to swap faces with friends or photos in real-time, featuring a variety of built-in masks, face warping, and AR face swaps for endless fun.",The user sees their talking face on Marilyn Monroe's photo.,"['face image', ""Marilyn Monroe's photo"", ""user's photo""]"
"The mobile app is a comprehensive photography tool that enhances your iPhone camera capabilities with features like touch exposure, digital zoom, scene modes, effects, and sharing options, providing users with the ability to take great photos and edit them seamlessly.",Different border designs are available in Camera+ to add finishing touches to photos.,"['photos', 'preferred border designs']"
"The mobile app offers over 900 fun and stylish photo effects, including montages, filters, frames, and caricature effects, with a neat interface for easy creation and sharing of unique photo montages and collages without ads or watermarks.",The user can add their own text onto the picture for most effects.,"['text content', 'pictures', 'preferred effects', 'creative preferences']"
"The mobile app is a universal video and audio baby monitoring tool that allows you to listen to sounds, stream live video, and soothe your child remotely with unlimited range, available on various devices and platforms, with features such as live HD video, activity log, night mode, two-way communication, lullabies, nightlight, vibration alarm, and customization options, prioritizing reliability, security, and privacy.",The user can check their baby's activity log to track sleep patterns and replay sounds from monitoring sessions.,"[""baby's sleep patterns"", 'baby monitoring sessions']"
"The mobile app provides a fully redesigned experience for Vodafone Mobile and Vodafone Home subscribers to easily manage their mobile and fixed line services, including controlling usage, activating bundles, viewing and paying bills, accessing special offers, reporting network issues, and contacting customer service.",The user searches for the nearest Vodafone shop using an interactive map in My Vodafone.,"['location', 'search query', 'device type']"
"The mobile app tracks Heart Rate Variability measurements from your Apple Watch to provide insight on your body's stress levels, readiness, recovery, and overall health, with features like notifications, daily tracking, comparison with key metrics, long-term trend analysis, and widgets for easy monitoring.",The user views widgets on their iPhone that display HRV values and trends.,"['HRV values', 'HRV trends']"
"The mobile app provides users with a comprehensive overview of their pension scheme, including savings, returns, insurance policies, contributions, costs, and the option to book consultations and meetings with advisors, accessible in both Danish and English.",The user can follow the deposits and contributions.,"['financial transactions', 'contributions']"
