summary,actions,datatypes
"The mobile app offers convenient shopping options, including exclusive promotions, online ordering with delivery or pick-up, digital SuperPlus card access, Nutri-Score discounts, and easy access to account features such as e-Deals and point redemption.",The user benefits from discounts on fresh products with Nutri-Score A or B through Nutri-Boost.,"['shopping preferences', 'nutritional preferences', 'location data']"
"The mobile app offers access to 55,000 beauty products, exclusive member benefits, social sharing, beauty trends, tutorials, reviews, product ratings, favorites saving, customer service chat, giveaways, and a variety of beauty inspirations and hacks in a judgment-free environment.",The user explores various beauty styles and scents.,"['beauty styles', 'scents']"
"The mobile app Packing Pro is a super-enhanced travel list app with unlimited, customizable packing lists, iCloud support, sharing options, expert list assistance, a huge master catalog, sample packing lists, and customizable design features.",Users can print packing lists directly to a printer with multiple columns.,"['packing lists', 'printer preferences']"
"The mobile app offers a convenient shopping experience with a wide range of brands, exclusive benefits, digital receipts, events, surprises, and competitions, including access to the beauty universe Goodie Beauty, encouraging users to download for a comprehensive Goodie experience.",The user utilizes the scan feature to retrieve pricing and information about products in-store.,"['location data', 'purchase history', 'product preferences', 'scanned products']"
"The mobile app allows users to plan routes along official hiking trails in Poland, record tracks, view points of interest, and access detailed touristic maps for various regions, with offline map downloads available.",The user plans hiking routes along official trails in Poland.,"['location', 'hiking interests', 'trail preferences', 'fitness level', 'planned itinerary']"
"The mobile app helps users plan and navigate their journeys with multiple modes of transport, purchase tickets conveniently, keep all tickets in one place, compare route options, and easily manage ticket information and payments.",The user buys all the tickets for their journey in one go through the app.,"['payment information', 'travel destination', 'travel dates', 'passenger names']"
"The mobile app provides a convenient way to manage incoming and outgoing shipments, check postal hours, create a queue ticket for faster postal service, make online postage payments, track shipments, and receive notifications about shipment status updates.",The user can submit shipments without waiting at the post office by providing shipment data and paying postage through the application.,"['shipment data', 'payment information']"
"The mobile app is a health and wellness platform in the Baltics with over 130,000 users, offering a variety of services to help users take care of their wellness, track health expenses, and use employer-provided compensation.","Stebby users browse a wide selection of options including sports clubs, spas, rehabilitation services, massages, and health insurance.","['sports interests', 'health interests', 'location', 'health insurance preferences']"
"The mobile app provides easy and convenient access to selected ABUS products through a user-friendly interface, allowing for setup of cameras and recorders via QR code or IP address input, simultaneous viewing of recordings and live images from up to 16 cameras, remote access to live images and recordings, push notifications for events like doorbells, direct saving of images/clips, pinch-to-zoom function, control of PTZ cameras, and operation of switches or relays for functions like opening doors or activating light switches.",The user arranges camera layout using drag & drop feature.,"['camera layout', 'drag & drop feature']"
"The mobile app offers convenient access to check usage, manage Wi-Fi network, pay bills, and oversee services with ease, ensuring users are always up to date on their Telenet account.",The user authorizes and administers direct debit payments.,"['bank account information', 'payment amounts', 'payment schedules', 'transaction history']"
"The mobile app is a comprehensive companion for Tesla vehicles, offering convenient features such as using your watch as a vehicle key, monitoring charge status, controlling vehicle functions, and ensuring security and privacy through direct communication with Tesla API servers.",The user receives a notification if their vehicle is in a pre-configured location and not plugged in.,"['vehicle location', 'plug status']"
"The mobile app offers a holistic well-being plan and mental health activities personalized by psychologists to help users improve various aspects of their lives, track their progress, and access support from professionals, all aimed at enhancing mental peace and reducing stress and anxiety.","VOS Plan invites the user to personalized daily activities such as breathing exercises, meditation, and online therapy chat.","['daily activities', 'breathing exercises', 'meditation', 'online therapy chat']"
"The mobile app offers convenient shopping options, including exclusive promotions, online ordering with delivery or pick-up, digital SuperPlus card access, Nutri-Score discounts, and easy access to account features such as e-Deals and point redemption.","The user accesses their Superplus account to activate e-Deals, check Superplus credit, redeem points, or donate points to charity.","['Superplus account information', 'e-Deals activation status', 'Superplus credit balance', 'Redeemed points history', 'Donated points history']"
"The mobile app offers a fun and interactive hair salon experience with realistic hair styling, a variety of tools, braiding options, beard grooming, advanced hair color tools, clothing changes, accessories, photo booth features, and a gender-neutral aesthetic for kids to enjoy without time limits or third-party advertising.",The user styles the hair of the selected character using realistic hair movements.,"['hairstyle preferences', 'character selection', 'hair movement data']"
"The mobile app is a GPS camera used for fieldwork, allowing users to overlay and stamp photos with location, direction, altitude, date, and time taken, with additional features available for purchase such as editable notes overlay, custom export filename, batch edit notes overlay fields, and more.","The user overlays and stamps photos with location, direction, altitude, date & time taken.","['photos', 'location data', 'direction data', 'altitude data', 'date & time data']"
"The mobile app provides a comprehensive overview of Club Matas member benefits, personalized shopping experiences with a wide range of products, opportunities to earn bonus gifts through Mine Brands, daily competitions, and assistance with in-store discounts and product information.","The user has a personalized shopping experience by searching, scanning a barcode, or taking a picture to find desired products.","['search history', 'scanned barcodes', 'product preferences', 'images taken for product search']"
"The mobile app is an intuitive and powerful function generator that allows users to play various test tones, frequency sweeps, volume sweeps, music tones, and noise types, with advanced settings for customization and configuration flexibility.",The user uses the BPM (Beats per Minute) feature.,"{'Personal data': ['heart rate', 'physical activity level', 'music preferences']}"
"The mobile app offers convenient access to check usage, manage Wi-Fi network, pay bills, and oversee services with ease, ensuring users are always up to date on their Telenet account.",The user measures internet speed or reboots the modem via the app.,"['internet speed', 'modem status']"
