summary,actions,datatypes
"The mobile app provides visualized METAR and TAF weather information for all airports worldwide, with features such as easy-to-understand metrics, weather symbols, crosswind calculations, flight rule categories, voice synthesis reading, sunrise/sunset times, and customizable units, offering a comprehensive tool for aviation weather forecasting.",The app provides weather symbols for significant weather and clouds similar to non-aviation weather reports.,"{'personal_data': ['location', 'weather preferences']}"
"The mobile app allows users to manage their electricity and gas-related matters, such as submitting meter readings, paying bills, viewing multiple account statements, and setting up notifications for bill arrivals and meter reading periods.",The user can add a designated payer to their usage point to pay bills on their behalf.,"[""designated payer's information"", 'billing details']"
"The mobile app is a user-friendly stop-motion animation tool that allows users to easily create professional-looking movies, offering a variety of features such as video filters, soundtracks, green screen effects, and a powerful built-in image editor, with the ability to share projects in high quality and continue editing seamlessly across devices.",The Washington Post mentions how easy it is to create stop-motion movies with Stop Motion Studio.,{'Personal data': []}
"The mobile app offers over 70 million official songs, live performances, personalized playlists, and music discovery features, allowing users to enjoy a tailored music experience for various activities and moods, along with the option to upgrade to Music Premium for an ad-free experience and additional benefits.","The user explores the latest music trends, including new releases, music by genre (e.g., Hip-Hop, Pop, Rock), and music by mood.","['music preferences', 'genre preferences', 'mood preferences']"
"The mobile app from a bio-medical testing laboratory offers secure access to test results, history, preparation information, graphical displays for certain tests, center locations, news updates, and the ability to rate and provide feedback on your experience.",The user views the results of their last test and receives a notification when available.,"['test results', 'notifications']"
"The mobile app offers a diagnostic method called the Matrix of Destiny 22 Energies, based on the date of birth, which helps reveal different life plans, keys to healing fate, talents, potential, and purpose, ultimately guiding users towards becoming a harmonious and holistic personality by understanding and mastering the 22 energies of the Major Arcana of the tarot.","Using the method, a person can find answers to various questions in their life such as money, health, relationships, and talent.","['financial information', 'health information', 'relationship status', 'talents']"
"The mobile app offers convenient access to check usage, manage Wi-Fi network, pay bills, and oversee services with ease, ensuring users are always up to date on their Telenet account.",The user enables Wi-Fi Sharing to give guests instant network access.,"['Wi-Fi network information', 'device information']"
"The mobile app from a bio-medical testing laboratory offers secure access to test results, history, preparation information, graphical displays for certain tests, center locations, news updates, and the ability to rate and provide feedback on your experience.",The user keeps up to date with Ketterthill laboratory news in the News section.,"['news preferences', 'medical interests']"
"The mobile app offers fast, smart, and anonymous browsing with a redesigned interface, enhanced anonymity features, private browsing mode, and intuitive design, utilizing the Tor anonymization network to prioritize user anonymity and privacy.",The app features a user-friendly interface for comfortable browsing experience.,"['device preferences', 'user interface interactions', 'browsing habits']"
"The mobile app manages tasks on Synology's Download Station, supporting features like task management, task search, and secure login options.",The user saves all user credentials in the Keychain for convenience.,['user credentials']
"The mobile app provides a convenient way to manage incoming and outgoing shipments, check postal hours, create a queue ticket for faster postal service, make online postage payments, track shipments, and receive notifications about shipment status updates.","The user gets an overview of incoming and outgoing shipments, current opening hours, number of people in line, or creates a queue for faster processing at the post office.","['shipment details', 'opening hours', 'queue information', 'location data']"
"The mobile app provides a fully redesigned experience for Vodafone Mobile and Vodafone Home subscribers to easily manage their mobile and fixed line services, including controlling usage, activating bundles, viewing and paying bills, accessing special offers, reporting network issues, and contacting customer service.",The user views their monthly bill and downloads its PDF for prepaid services.,"['billing information', 'PDF downloads', 'prepaid services']"
"The mobile app is Denmark's new platform for digital mail, allowing users to easily receive, read, and respond to important messages from public authorities and private companies, with user-friendly design, push notifications, and upcoming features for signing documents and paying bills directly within the app, accessible for users over 15 years old with a MitID/NemID.",The user receives digital mails from public authorities and private companies.,"{'Personal data': ['email address', 'name', 'contact information', 'government identification numbers', 'financial information']}"
"The mobile app offers up to 75% off on fashion, lifestyle brands with live and upcoming deals, exclusive discounts, and special seasonal sales, available in select European countries.",The user benefits from deals with up to 75% off on the latest trends.,"{'Personal data': ['shopping preferences', 'purchase history', 'discount preferences']}"
"The mobile app De Saison helps users quickly find fruits and vegetables that are currently in season, providing detailed information and features like seasonal produce lists, an annual calendar, and instant identification using the device's camera.",The app is written entirely in Swift and SwiftUI.,['none']
"The mobile app offers engaging quiz-based games (kahoots) for students, teachers, company employees, trivia fans, and lifelong learners to increase engagement and learning, with features including creating and hosting quizzes, access to millions of learning games, and various study modes across different platforms.",Users explore and discover millions of ready-to-play quiz-based learning games (kahoots).,"['quiz topics', 'learning preferences', 'performance data']"
"The mobile app provides visualized METAR and TAF weather information for all airports worldwide, with features such as easy-to-understand metrics, weather symbols, crosswind calculations, flight rule categories, voice synthesis reading, sunrise/sunset times, and customizable units, offering a comprehensive tool for aviation weather forecasting.",The app displays METAR in easy-to-understand and color-coded metrics.,"['location preferences', 'weather interests']"
"The mobile app provides real-time updates on car traffic at Hungarian border crossings and users can contribute by reporting their border crossing times to improve accuracy, with plans to expand to other countries.",The user indicates the duration of their border crossing to contribute to more accurate information.,['border crossing duration']
"The mobile app offers a personalized music streaming experience with a vast music catalog, personalized playlists, offline listening, and various features like music identification, customized recommendations, and different subscription options for ad-free, high-quality music streaming.",The user creates children profiles for explicit content with Deezer Family.,"['children profiles', 'age of children', 'explicit content preferences']"
"The mobile app provides essential information and tools to help UK Foundation doctors navigate common clinical scenarios with ease and confidence, featuring assessment guides, management protocols, reference materials, and medical calculators.",All documents are downloaded into the app and are available at all times for users.,['documents']
"The mobile app offers low-cost flight deals to over 200 destinations, along with options to book hotels, airport parking, car hire, taxi services, and more, making it easy to plan and organize your travel experience efficiently.",The user searches for low-cost flight deals and selects from 200+ destinations.,"['flight deals', 'selected destinations', 'budget preferences']"
"The mobile app allows users to easily book, manage, and check in for trips with Aer Lingus, access boarding passes, receive live flight updates, earn AerClub rewards, and enjoy in-flight dining and shopping options.","Users can sign up for AerClub, earn, redeem, and track AerClub rewards using the app.","['name', 'email address', 'date of birth', 'contact information', 'payment information']"
The mobile app offers a selection of the best fireplaces to create a relaxing atmosphere accompanied by soothing nature sounds for relaxation and sleep.,The app plays calming nature sounds to help the user relax and sleep.,"['sleep patterns', 'stress levels', 'preferred sounds']"
"The mobile app revolutionizes the traditional calculator design with a freeform canvas, responsive results, linked numbers, real-time graphing, and extensive features for everyday and advanced calculations, offering a modern, efficient, and versatile tool for iPhone and iPad users.",The user uses undo support for reverting changes.,"{'personal data': ['changes made', 'time of changes', 'device information']}"
"The mobile app provides real-time economic data on the US Federal Government, 50 States, and World, including historical comparisons, debt levels, GDP, unfunded liabilities, military costs, occupations, natural disasters, consumer prices, and more.",The user travels back in time to the year 1100 for a complete history of money and banking.,"['location history', 'interest in history', 'interest in money and banking']"
"The mobile app zVEM provides quick and easy access to medical reports, prescriptions, and other documents within the eHealth system, offering services such as viewing health documentation, ePrescriptions, eReferrals, waiting times, receiving push notifications for new health documents, and issuing and storing digital COVID certificates for travel within the EU and some other countries, requiring access via the zVEM web portal with a QR code authorization and a SI-PASS account with a qualified digital certificate or SMS-pass login mechanism.","Users view health documentation (test results, authorizations, and other documentation).","['health documentation', 'test results', 'authorizations']"
"The mobile app offers over 180 knots across various categories for fishing, climbing, boating, scouting, and more, with detailed reference information and interactive 3D animations for easy learning and practice.",The user enjoys high-res graphics with photo-realistic rope textures while learning knots in Knots 3D app.,"['knots learning activity', 'graphics preferences', 'app usage data']"
"The mobile app revolutionizes the traditional calculator design with a freeform canvas, responsive results, linked numbers, real-time graphing, and extensive features for everyday and advanced calculations, offering a modern, efficient, and versatile tool for iPhone and iPad users.","The user shares the canvas by printing, exporting as PDF, copying calculations as text, or saving as an image.","['canvas', 'calculations']"
"The mobile app offers access to over 16,000 makeup, fragrance, and beauty brands, exclusive promotions, makeup and skincare tutorials, appointment booking with experts, and sharing experiences with the Sephora beauty community.","The user benefits from exclusive promotions on makeup, perfumes, skincare, and beauty accessories.","['makeup preferences', 'perfume preferences', 'skincare preferences', 'beauty accessory preferences']"
"The mobile app offers convenient access to check usage, manage Wi-Fi network, pay bills, and oversee services with ease, ensuring users are always up to date on their Telenet account.","The user checks their mobile data, texts, and minutes usage.","['mobile data usage', 'text messages usage', 'minutes usage']"
"The mobile app De Saison helps users quickly find fruits and vegetables that are currently in season, providing detailed information and features like seasonal produce lists, an annual calendar, and instant identification using the device's camera.",The user quickly finds fruits and vegetables that are currently in season.,"['location', 'season', 'food preferences']"
"The mobile app aims to raise awareness of face-touching behavior by detecting and alerting users when their Watch-wearing hand nears their face during hour-long training sessions, without claiming to diagnose or treat any medical conditions.",The user increases the sensitivity of face-touch detection if needed.,['face-touch detection sensitivity']
"The mobile app by the Automobile Club Luxembourg provides fast and efficient assistance, including features like eCall mobile, traffic information, news updates, eCharging stations, and a digital membership card, accessible in multiple languages and offering valuable benefits to ACL members.",The user activates location services for their mobile device.,{'Personal data': ['location data']}
"The mobile app transforms your photos into luminous watercolors, allowing you to create beautiful art for your home and share on social media, with customizable styles and high-resolution export options, supported on iOS devices.",The user follows @Tinrocket on Instagram and Twitter for the latest updates.,"['social media handles', 'interest in updates']"
"The mobile app offers a simple, friendly, and intuitive shopping experience with a wide range of products available for quick and secure purchase, offering the option for home delivery or in-store pickup, as well as the ability to save desired items in a wishlist and choose payment methods like cash on delivery or interest-free installments.","The user has all offers in one place, whether they want perfumes, cosmetics, beverages, toys, appliances, or IT products.","{'personal_data': ['shopping preferences', 'interests in perfumes', 'interests in cosmetics', 'interests in beverages', 'interests in toys', 'interests in appliances', 'interests in IT products']}"
"The mobile app makes it easy to manage MEO services, offering tailored deals, enhancing MEO experience, managing family services, viewing and paying bills, tracking usage, utilizing a digital assistant, accessing contract information, obtaining PIN and PUK for mobiles, and accessing customer support channels.","The user explores products, apps, and services provided by MEO for both home and outside use.","['products', 'apps', 'services', 'home use preferences', 'outdoor use preferences']"
"The mobile app allows users to connect with others for free video calls, messaging, and personalized news, as well as utilize Bing GPT-4 for trip planning, jokes, film recommendations, and creative questions, and offers additional features like a second phone number and various permissions for enhanced functionality.",The user shares their screen to show what they're working on.,"['screen content', 'work projects', 'software applications']"
"The mobile app is a comprehensive Greek calendar and events app with features like SMS reminders, multiple customization options, Greeklish translation, and a large database of events.",The user manages document categories and subcategories for better organization.,"['document categories', 'subcategories', 'organization preferences']"
"The mobile app offers personal advice, market navigation, inspiration, care calendar, exclusive discounts, and more for DIY projects related to home and garden, providing expert tips, step-by-step guides, and shopping assistance with the ability to receive support via chat or video, and access to exclusive deals and product information directly on your smartphone, making it a convenient tool for all your DIY needs.",The user receives tips and tricks for their DIY project.,"['DIY project details', 'crafting skills', 'materials used', 'tools required']"
"The mobile app offers a convenient and enjoyable shopping experience for shoes, handbags, clothing, and accessories from various top brands, along with features like membership benefits, product availability checking, image search, barcode scanner, and payment options, while also providing fashion inspiration and customer support.",The user scans their feet in the CCC or eFootwear store for esize.me recommendations.,"['foot scans', 'shoe size', 'foot shape']"
"The mobile app offers convenient shopping options, including exclusive promotions, online ordering with delivery or pick-up, digital SuperPlus card access, Nutri-Score discounts, and easy access to account features such as e-Deals and point redemption.","The user orders products, pays safely, and arranges for delivery to their home or shop.","['order details', 'payment information', 'delivery address', 'billing address']"
"The mobile app from a bio-medical testing laboratory offers secure access to test results, history, preparation information, graphical displays for certain tests, center locations, news updates, and the ability to rate and provide feedback on your experience.",The user finds useful information to help prepare for examinations.,"['exam topics', 'study materials', 'test schedules', 'performance results']"
"The mobile app offers a comprehensive solution for banking and insurance needs, allowing users to manage finances, investments, loans, insurance policies, and access a range of additional services like ticket ordering and property transactions conveniently and securely.","The user can transfer money, manage finances, insurances, investments, and loans using the app.","['financial transactions', 'account information', 'insurance details', 'investments', 'loan details']"
"The mobile app is a professional astrology program for iPhone that offers accurate calculations, smart descriptions, and a wide range of special techniques, including the ability to build various types of astrological charts, view ephemerides and aspects, save and edit natal data, and generate weekly graphic forecasts based on transit aspects to radix.","The user saves, loads, changes natal data in DB.",['natal data']
"The mobile app offers low-cost flight deals to over 200 destinations, along with options to book hotels, airport parking, car hire, taxi services, and more, making it easy to plan and organize your travel experience efficiently.",The user stays connected with 5G data roaming over 160 countries with eSim and Fast Track.,"['location data', 'travel history', 'device information', 'network usage data']"
"The mobile app offers a variety of benefits and features for shopping, including the ability to purchase favorite products, access to services such as gl端ckskind and PAYBACK, and a unified view of all coupons, with the option to customize the app based on personal preferences and easily redeem coupons both in-store and online.","The user navigates through product categories such as Baby & Kind, Make-up, Health, etc. using the search function.","['product categories', 'search history']"
"The mobile app offers a convenient and enjoyable shopping experience for shoes, handbags, clothing, and accessories from various top brands, along with features like membership benefits, product availability checking, image search, barcode scanner, and payment options, while also providing fashion inspiration and customer support.",The user joins the CCC Club to access promotions and benefits.,"['email address', 'name', 'date of birth', 'location', 'interests']"
"The mobile app is a health and wellness platform in the Baltics with over 130,000 users, offering a variety of services to help users take care of their wellness, track health expenses, and use employer-provided compensation.",Stebby users use the compensation provided by their employer for services.,"{'Personal data': ['compensation details', 'employment status', 'employer information']}"
"The mobile app is a convenient extension for Safari that allows you to translate entire webpages or paragraphs in over 140 languages, maintain the visual layout of the page, and seamlessly integrate with other iOS applications for easy translation.","The user sends support emails with questions, feedback, or complaints.","['email address', 'name', 'questions', 'feedback', 'complaints']"
"The mobile app by the Automobile Club Luxembourg provides fast and efficient assistance, including features like eCall mobile, traffic information, news updates, eCharging stations, and a digital membership card, accessible in multiple languages and offering valuable benefits to ACL members.",The app automatically routes voice calls from ACL affiliates to a priority phone line.,"{'personal_data': ['phone number', 'affiliation with ACL affiliates']}"
"The mobile app, a European number one study tool for middle and high schools, provides free access to high-quality study materials, personalized study plans, interactive learning features, AI assistance, and a supportive learning community to help students improve their academic performance and make studying more enjoyable.","The user organizes their school life by creating a personalized study plan, libraries, and private study folders.","['study plan', 'libraries', 'private study folders', 'school subjects']"
"The mobile app provides real-time information on speed cameras and traffic conditions in over 140 different regions, featuring a map with 38,000 fixed cameras across Europe, offline database, voting system, push notifications, and the ability to report and comment on speed cameras.",The user interacts with the overview page showing all current Blitzers.,"['username', 'profile pictures', 'blitzing activity', 'location']"
"The mobile app is a video surveillance tool specifically designed for viewing up to 16 cameras connected to S-VIDIA brand security video servers, offering low bandwidth usage and the ability to manage multiple connection profiles.",App only works with S-VIDIA brand security video recorders.,{'personal data': []}
"The mobile app allows users to manage their electricity and gas-related matters, such as submitting meter readings, paying bills, viewing multiple account statements, and setting up notifications for bill arrivals and meter reading periods.",The user can dictate meter readings and check their previous meter reading data.,"['meter readings', 'previous meter reading data']"
"The mobile app provides a convenient way to manage incoming and outgoing shipments, check postal hours, create a queue ticket for faster postal service, make online postage payments, track shipments, and receive notifications about shipment status updates.",The user can print address labels for their shipments directly from the application.,['shipping address']
"The mobile app helps users manage and analyze their assets, offering insights on asset trends, classification, optimal investment portfolios, and providing AI-powered analysis to support a steady investment journey, optimized for long-term investing and discouraging short-term speculation.",The user views trends in the amount of assets and the amount of each type of asset.,"['financial assets', 'asset types']"
"The mobile app provides easy access to information about packages delivered to a nearby locker, sending notifications when packages are ready for pickup and allowing users to open the locker door via Bluetooth.",The user switches between multiple languages in the app.,"['preferred languages', 'language settings']"
"The mobile app enhances online account security by requiring a second verification step during login, generating codes on your smartphone for authentication, and offering features such as code synchronization, QR code setup, support for multiple accounts, and transfer of accounts between devices.",The user activates two-step verification in their Google account.,"['Google account', 'verification method']"
"The mobile app is a user-friendly stop-motion animation tool that allows users to easily create professional-looking movies, offering a variety of features such as video filters, soundtracks, green screen effects, and a powerful built-in image editor, with the ability to share projects in high quality and continue editing seamlessly across devices.","Users can save and share their creations in various formats, including storing in the photo library, sharing on YouTube in high resolutions, saving as iMessage stickers or animated GIFs, transferring projects between devices using AirDrop, Dropbox, or iCloud, and seamlessly switching between mobile and Mac devices for continued editing.","['creations', 'photos', 'videos', 'iMessage stickers', 'animated GIFs', 'projects', 'device information', 'location data']"
"The mobile app is a one-stop-shop for the best Dutch entertainment, offering a variety of films, series, and live TV programs that can be streamed on multiple devices with the option to try for two weeks free and cancel monthly.",The user accesses a variety of films and series in one place.,"['watched films', 'watched series', 'preferred genres', 'watch history']"
